question,answer
What is a cost function?,"A cost function is the average loss over the entire training dataset, used to optimize model parameters."
What is convergence in optimization?,Convergence occurs when an optimization algorithm reaches a point where further updates produce negligible improvement.
What is a local minimum?,A local minimum is a point where the loss function is lower than nearby points but not necessarily the lowest overall.
What is a global minimum?,A global minimum is the lowest possible value of the loss function across the entire parameter space.
What is momentum in optimization?,"Momentum accelerates gradient descent by adding a fraction of the previous update to the current one, smoothing convergence."
What is the Adam optimizer?,Adam is an adaptive optimization algorithm that combines momentum and adaptive learning rates for efficient training.
What is RMSprop?,RMSprop is an optimization algorithm that adapts the learning rate based on a moving average of squared gradients.
What is early stopping?,"Early stopping halts training when validation performance stops improving, preventing overfitting."
What is data leakage?,"Data leakage occurs when information from outside the training dataset is used to create the model, leading to overly optimistic results."
What is train-test split?,Train-test split divides a dataset into separate portions for training and evaluating a model's performance.
What is deep learning?,Deep learning is a subset of ML using neural networks with multiple layers to learn complex patterns.
What is a neural network?,"A neural network is a deep learning model inspired by the human brain, consisting of layers of interconnected nodes."
What is a perceptron?,A perceptron is the simplest neural network unit that makes decisions by weighting input signals and applying an activation function.
What is an activation function?,"An activation function introduces non-linearity into a neural network, allowing it to learn complex patterns."
What is ReLU?,"ReLU (Rectified Linear Unit) is an activation function that outputs the input directly if positive, otherwise zero."
What is sigmoid activation?,"Sigmoid is an activation function that maps input values to a range between 0 and 1, often used for binary classification."
What is tanh activation?,Tanh is an activation function that maps input values to a range between -1 and 1.
What is softmax activation?,"Softmax converts a vector of values into a probability distribution, commonly used in multi-class classification output layers."
What is the vanishing gradient problem?,"The vanishing gradient problem occurs when gradients become very small during backpropagation, slowing or stopping learning in deep networks."
What is the exploding gradient problem?,"The exploding gradient problem occurs when gradients grow excessively large during training, causing unstable updates."
What is backpropagation?,Backpropagation is the algorithm used to train neural networks by adjusting weights based on error gradients.
What is a forward pass?,A forward pass computes the output of a neural network by passing input data through its layers.
What is a hidden layer?,A hidden layer is an intermediate layer between input and output layers that learns internal representations of data.
What is dropout in DL?,Dropout is a regularization technique that randomly ignores neurons during training to prevent overfitting.
What is batch normalization?,Batch normalization normalizes layer inputs during training to stabilize and accelerate learning.
What is weight initialization?,"Weight initialization sets the starting values of neural network weights, affecting training speed and convergence."
What is an epoch?,An epoch is one complete pass of the entire training dataset through a neural network.
What is a batch size?,Batch size is the number of training samples processed before the model's internal parameters are updated.
What is CNN?,A Convolutional Neural Network (CNN) is a deep learning model specialized for image recognition and computer vision tasks.
What is a convolutional layer?,A convolutional layer applies filters to input data to extract spatial features such as edges and textures.
What is a filter or kernel in CNN?,A filter is a small matrix that slides over input data to detect specific patterns through convolution.
What is pooling in CNN?,"Pooling reduces the spatial dimensions of feature maps while retaining important information, commonly using max or average pooling."
What is max pooling?,Max pooling selects the maximum value from a region of the feature map to down-sample data.
What is padding in CNN?,Padding adds extra pixels around input data to control the spatial size of output feature maps.
What is stride in CNN?,Stride determines how many pixels a filter moves at each step during convolution.
What is a feature map?,"A feature map is the output of applying a filter to input data, highlighting detected patterns."
What is transfer learning in CNNs?,Transfer learning in CNNs reuses pre-trained models on new tasks to reduce training time and improve performance with limited data.
What is RNN?,A Recurrent Neural Network (RNN) is designed for sequential data such as text or time series.
What is a hidden state in RNN?,A hidden state stores information from previous time steps to influence current predictions in an RNN.
What is LSTM?,"Long Short-Term Memory (LSTM) is a type of RNN that solves the vanishing gradient problem, useful for long sequences."
What is a GRU?,"A Gated Recurrent Unit (GRU) is a simplified version of LSTM with fewer gates, offering similar performance with less complexity."
What is a forget gate in LSTM?,A forget gate decides what information to discard from the cell state in an LSTM network.
What is sequence-to-sequence modeling?,"Sequence-to-sequence modeling maps an input sequence to an output sequence, used in translation and summarization tasks."
What is an encoder-decoder architecture?,"An encoder-decoder architecture encodes input data into a fixed representation, which a decoder uses to generate output sequences."
What is attention mechanism?,"Attention mechanism allows models to focus on relevant parts of input data when generating output, improving performance on long sequences."
What is self-attention?,Self-attention allows a model to weigh the importance of different positions within the same input sequence.
What is a transformer model?,A transformer is a deep learning architecture that uses self-attention mechanisms to process sequential data in parallel.
What is positional encoding?,Positional encoding adds information about token order to transformer inputs since they lack inherent sequence awareness.
What is multi-head attention?,Multi-head attention runs multiple attention mechanisms in parallel to capture different relationships in data.
What is a GAN?,A Generative Adversarial Network (GAN) consists of a generator and discriminator that compete to produce realistic synthetic data.
What is the generator in a GAN?,The generator in a GAN creates synthetic data samples designed to resemble real data.
What is the discriminator in a GAN?,"The discriminator in a GAN evaluates whether a given sample is real or generated, guiding the generator's improvement."
What is an autoencoder?,"An autoencoder is a neural network that learns to compress and reconstruct input data, useful for dimensionality reduction and anomaly detection."
What is a variational autoencoder?,"A variational autoencoder learns a probabilistic latent representation of data, enabling generation of new samples."
What is a latent space?,"Latent space is a compressed representation of data learned by a model, capturing essential features."
What is model checkpointing?,Model checkpointing saves a model's state during training so it can be resumed or evaluated later.
What is GPU acceleration in deep learning?,"GPU acceleration uses graphics processing units to perform parallel computations, significantly speeding up neural network training."
What is a tensor?,A tensor is a multi-dimensional array used to represent data and parameters in deep learning frameworks.
What is computational graph in deep learning?,"A computational graph represents the sequence of operations performed on tensors, used for automatic differentiation."
What is automatic differentiation?,"Automatic differentiation computes derivatives of functions automatically, enabling efficient gradient calculation in neural networks."
What is model capacity?,"Model capacity refers to a model's ability to fit a wide variety of functions, with higher capacity risking overfitting."
What is Natural Language Processing?,"Natural Language Processing (NLP) is a field of AI focused on enabling computers to understand, interpret, and generate human language."
What is tokenization in NLP?,Tokenization splits text into smaller units like words or subwords for processing.
What is stemming?,"Stemming reduces words to their root form, e.g., ""running"" -> ""run""."
What is lemmatization?,"Lemmatization reduces words to their base form using vocabulary and grammar, e.g., ""better"" -> ""good""."
What is the difference between stemming and lemmatization?,"Stemming chops words based on rules without considering context, while lemmatization uses grammar and vocabulary to find the proper base form."
What is stop word removal?,"Stop word removal eliminates common words like ""the"" or ""is"" that carry little semantic meaning in text analysis."
What is part-of-speech tagging?,"Part-of-speech tagging assigns grammatical categories, such as noun or verb, to each word in a sentence."
What is named entity recognition?,"Named entity recognition identifies and classifies entities in text, such as names, locations, and organizations."
What is a bag of words model?,"The bag of words model represents text as an unordered collection of word frequencies, ignoring grammar and order."
What is TF-IDF?,TF-IDF (Term Frequency-Inverse Document Frequency) measures how important a word is to a document relative to a collection of documents.
What is n-gram in NLP?,An n-gram is a contiguous sequence of n words or characters used to capture local context in text.
What is word embedding?,"Word embeddings are vector representations of words that capture semantic meaning, e.g., Word2Vec, GloVe."
What is Word2Vec?,Word2Vec is a technique that learns word embeddings by predicting context words using neural networks.
What is GloVe?,GloVe is a word embedding technique that learns vector representations based on global word co-occurrence statistics.
What is the difference between Word2Vec and GloVe?,"Word2Vec learns embeddings through local context prediction, while GloVe uses global co-occurrence statistics across the corpus."
What is contextual embedding?,"Contextual embeddings generate different word representations depending on surrounding context, unlike static embeddings."
What is BERT?,BERT (Bidirectional Encoder Representations from Transformers) is a transformer-based NLP model for contextual understanding.
What is GPT?,GPT (Generative Pretrained Transformer) is a language model that generates human-like text based on prompts.
What is the difference between BERT and GPT?,"BERT is bidirectional and designed for understanding tasks, while GPT is unidirectional and optimized for text generation."
What is masked language modeling?,"Masked language modeling trains models to predict missing words in a sentence, used in BERT pretraining."
What is sentiment analysis?,"Sentiment analysis determines whether text expresses positive, negative, or neutral emotions."
What is text summarization?,Text summarization condenses long documents into shorter versions while preserving key information.
What is extractive summarization?,Extractive summarization selects important sentences directly from the original text to form a summary.
What is abstractive summarization?,"Abstractive summarization generates new sentences that capture the meaning of the original text, rather than copying it directly."
What is machine translation?,Machine translation automatically converts text from one language to another using NLP models.
What is a language model?,"A language model predicts the probability of a sequence of words, enabling text generation and understanding tasks."
What is perplexity in NLP?,"Perplexity measures how well a language model predicts a sample, with lower values indicating better performance."
What is text classification?,Text classification assigns predefined categories to text documents based on their content.
What is topic modeling?,Topic modeling identifies abstract topics within a collection of documents using statistical techniques.
What is Latent Dirichlet Allocation (LDA)?,LDA is a generative statistical model that assigns documents to topics based on word distributions.
What is coreference resolution?,Coreference resolution identifies when different words refer to the same entity within a text.
What is dependency parsing?,Dependency parsing analyzes the grammatical structure of a sentence by establishing relationships between words.
What is constituency parsing?,"Constituency parsing breaks a sentence into sub-phrases based on grammar rules, forming a tree structure."
What is discourse analysis?,Discourse analysis studies how sentences connect to form coherent meaning across larger units of text.
What is speech recognition?,Speech recognition converts spoken language into text using acoustic and language models.
What is text-to-speech?,Text-to-speech converts written text into spoken audio output.
What is a chatbot?,A chatbot is an AI application that simulates conversation with users through text or voice interfaces.
What is intent recognition in chatbots?,Intent recognition identifies the underlying purpose or goal behind a user's input in conversational AI.
What is slot filling in NLP?,"Slot filling extracts specific pieces of information from user input to complete a task, such as booking details."
What is a finite state automaton (FSA) in NLP?,"An FSA is a computational model used to represent and process patterns in text, such as morphological analysis."
What is morphology in NLP?,"Morphology studies the structure and formation of words, including prefixes, suffixes, and root forms."
What is syntax in NLP?,Syntax refers to the rules governing sentence structure and word arrangement in a language.
What is semantics in NLP?,"Semantics deals with the meaning of words, phrases, and sentences in language processing."
What is pragmatics in NLP?,Pragmatics studies how context influences the interpretation of meaning in language.
What is computational semantics?,Computational semantics represents and processes the meaning of natural language using formal computational methods.
What is word sense disambiguation?,Word sense disambiguation determines which meaning of a word is used based on context.
What is a corpus in NLP?,A corpus is a large structured collection of text used for training and evaluating NLP models.
What is sequence labeling?,"Sequence labeling assigns a label to each element in a sequence, such as tagging each word with its part of speech."
What is a hidden Markov model in NLP?,A hidden Markov model is a statistical model used for sequence labeling tasks by modeling hidden states and observed outputs.
What is Naive Bayes used for in NLP?,Naive Bayes is commonly used in NLP for text classification tasks like spam detection and sentiment analysis.
What is statistical NLP?,Statistical NLP uses probabilistic models and large corpora to analyze and generate human language.
What is computer vision?,Computer vision is a field of AI that enables machines to interpret and understand visual information from images and videos.
What is image classification?,Image classification assigns a category label to an entire image based on its visual content.
What is object detection?,Object detection identifies and localizes multiple objects within an image using bounding boxes.
What is image segmentation?,Image segmentation partitions an image into multiple regions or segments to simplify analysis.
What is semantic segmentation?,Semantic segmentation classifies each pixel in an image into a category without distinguishing individual object instances.
What is instance segmentation?,"Instance segmentation identifies and separates individual object instances within an image, even of the same class."
What is YOLO?,YOLO (You Only Look Once) is a real-time object detection algorithm that processes images in a single forward pass.
What is R-CNN?,R-CNN (Region-based CNN) is an object detection algorithm that uses region proposals combined with CNN feature extraction.
What is image augmentation?,"Image augmentation creates modified versions of training images through rotation, flipping, or scaling to improve model robustness."
What is optical character recognition (OCR)?,OCR converts images of text into machine-readable text data.
What is facial recognition?,Facial recognition identifies or verifies a person's identity using facial features extracted from images.
What is pose estimation?,Pose estimation detects the position and orientation of a person or object's key points in an image.
What is an agent in reinforcement learning?,An agent is the decision-making entity in reinforcement learning that interacts with an environment to maximize rewards.
What is an environment in reinforcement learning?,"The environment is the system an agent interacts with, providing states and rewards based on the agent's actions."
What is a reward function?,A reward function provides feedback signals that guide an agent toward desirable behavior in reinforcement learning.
What is a policy in reinforcement learning?,A policy defines the strategy an agent uses to decide actions based on the current state.
What is a value function?,A value function estimates the expected long-term reward of being in a particular state under a given policy.
What is Q-learning?,Q-learning is a model-free reinforcement learning algorithm that learns the value of actions in states to find an optimal policy.
What is the exploration-exploitation tradeoff?,The exploration-exploitation tradeoff balances trying new actions versus leveraging known rewarding actions in reinforcement learning.
What is a Markov Decision Process?,"A Markov Decision Process is a mathematical framework for modeling decision-making in environments with states, actions, and rewards."
What is deep reinforcement learning?,"Deep reinforcement learning combines deep neural networks with reinforcement learning to handle complex, high-dimensional environments."
What is generative AI?,"Generative AI refers to models that can create new content such as text, images, audio, or code based on learned patterns."
What is a diffusion model?,"A diffusion model generates data by gradually denoising random noise into a coherent output, used in image generation."
What is prompt engineering?,Prompt engineering is the practice of designing effective inputs to guide AI models toward desired outputs.
What is few-shot learning?,Few-shot learning enables models to learn new tasks from a very small number of labeled examples.
What is zero-shot learning?,Zero-shot learning allows models to perform tasks without having seen any labeled examples for that specific task.
What is fine-tuning?,Fine-tuning adapts a pre-trained model to a specific dataset or task.
What is transfer learning?,Transfer learning reuses knowledge from one task to improve performance on another related task.
What is a foundation model?,A foundation model is a large pre-trained model trained on broad data that can be adapted to many downstream tasks.
What is a large language model (LLM)?,A large language model is a deep learning model trained on massive text data to understand and generate human language.
What is retrieval-augmented generation (RAG)?,RAG combines a language model with an external knowledge retrieval system to produce more accurate and grounded responses.
What is hallucination in AI models?,Hallucination occurs when an AI model generates plausible-sounding but factually incorrect or fabricated information.
What is an embedding in AI?,"An embedding is a numerical vector representation of data, such as text or images, that captures semantic meaning."
What is vector database?,"A vector database stores and retrieves data based on embedding similarity, commonly used in semantic search and RAG systems."
What is cosine similarity?,"Cosine similarity measures the angle between two vectors to determine how similar their directions are, regardless of magnitude."
What is a multimodal model?,"A multimodal model processes and integrates multiple types of data, such as text, images, and audio, simultaneously."
What is an AI agent?,"An AI agent autonomously perceives its environment and takes actions to achieve specific goals, often using LLMs and tools."
What is in-context learning?,"In-context learning allows a model to adapt its behavior based on examples provided within the input prompt, without retraining."
What is model distillation?,"Model distillation trains a smaller model to replicate the behavior of a larger, more complex model, reducing computational cost."
What is quantization in deep learning?,Quantization reduces the precision of model weights to decrease memory usage and speed up inference.
What is pruning in deep learning?,Pruning removes unnecessary weights or neurons from a neural network to reduce size and improve efficiency.
What is model compression?,"Model compression reduces the size of a model while preserving as much performance as possible, useful for deployment."
What is edge AI?,Edge AI refers to running AI models directly on local devices rather than relying on cloud computing.
What is federated learning?,Federated learning trains models across multiple decentralized devices while keeping data local for privacy.
What is synthetic data?,Synthetic data is artificially generated data used to train models when real data is limited or sensitive.
What is anomaly detection?,"Anomaly detection identifies data points that deviate significantly from expected patterns, often used for fraud detection."
What is time series forecasting?,Time series forecasting predicts future values based on previously observed data points over time.
What is ARIMA?,ARIMA (AutoRegressive Integrated Moving Average) is a statistical model used for analyzing and forecasting time series data.
What is seasonality in time series?,Seasonality refers to repeating patterns or cycles in time series data at regular intervals.
What is stationarity in time series?,"Stationarity means a time series has statistical properties, like mean and variance, that remain constant over time."
What is AI in healthcare?,"AI automates claim processing, denial prediction, fraud detection, and patient chatbots in healthcare BPO."
What is AI in finance?,"AI is used for fraud detection, algorithmic trading, and customer support automation in banking and finance."
What is AI in retail?,"AI powers recommendation systems, demand forecasting, and customer chatbots in retail."
What is AI in manufacturing?,"AI enables predictive maintenance, quality control, and supply chain optimization in manufacturing."
What is AI in education?,"AI provides personalized learning, automated grading, and intelligent tutoring systems."
What is AI in agriculture?,"AI assists in crop monitoring, yield prediction, and precision farming using satellite and sensor data."
What is AI in transportation?,"AI enables route optimization, autonomous vehicles, and predictive maintenance in transportation systems."
What is AI in cybersecurity?,"AI detects threats, identifies anomalies, and automates responses to security incidents in real time."
What is AI in marketing?,"AI personalizes recommendations, optimizes ad targeting, and analyzes customer behavior in marketing."
What is AI in human resources?,"AI assists in resume screening, candidate matching, and employee sentiment analysis in HR."
What is a recommendation system?,A recommendation system suggests relevant items to users based on their preferences and behavior patterns.
What is collaborative filtering?,Collaborative filtering recommends items based on similarities between users or items derived from past interactions.
What is content-based filtering?,"Content-based filtering recommends items similar to those a user has previously liked, based on item attributes."
What is a hybrid recommendation system?,A hybrid recommendation system combines collaborative and content-based filtering to improve recommendation accuracy.
What is fraud detection in AI?,Fraud detection uses machine learning models to identify suspicious or anomalous transactions in real time.
What is predictive maintenance?,"Predictive maintenance uses AI to forecast equipment failures before they occur, reducing downtime and costs."
What is demand forecasting?,Demand forecasting predicts future customer demand using historical data and machine learning models.
What is churn prediction?,"Churn prediction identifies customers likely to stop using a product or service, enabling proactive retention strategies."
What is AI ethics?,"AI ethics involves fairness, transparency, accountability, and avoiding bias in AI systems."
What is bias in AI?,Bias in AI occurs when a model produces systematically unfair outcomes due to skewed training data or flawed assumptions.
What is algorithmic fairness?,Algorithmic fairness ensures AI systems make decisions without discriminating against particular groups.
What is explainable AI?,Explainable AI provides human-understandable insights into how models make decisions.
What is interpretability in ML?,Interpretability refers to the degree to which a human can understand the reasoning behind a model's predictions.
