question,answer
What is Python?,"Python is a high-level programming language widely used in AI, ML, and data science for its simplicity and rich libraries."
What are Python lists?,Lists are mutable sequences in Python used to store multiple items in a single variable.
What is a Python dictionary?,A dictionary is a collection of key-value pairs used for fast lookups and mappings.
What is a Python tuple?,"A tuple is an immutable ordered sequence of elements, often used for fixed collections of data."
What is a Python set?,"A set is an unordered collection of unique elements, useful for membership tests and removing duplicates."
What is a list comprehension?,A list comprehension is a concise way to create lists using a single line of code with an expression and a loop.
What is a lambda function?,"A lambda function is a small anonymous function defined with the lambda keyword, used for short operations."
What is the difference between deep copy and shallow copy?,"A shallow copy copies references to nested objects, while a deep copy recursively copies all nested objects."
What are Python decorators?,Decorators are functions that modify the behavior of another function without changing its source code.
What is a generator in Python?,"A generator is a function that yields values one at a time using the yield keyword, saving memory for large datasets."
What is NumPy used for?,NumPy is a Python library used for fast numerical computations on arrays and matrices.
What is Pandas used for?,Pandas is a Python library for data manipulation and analysis using DataFrames and Series.
What is a DataFrame?,A DataFrame is a two-dimensional labeled data structure in Pandas similar to a table or spreadsheet.
What is Matplotlib used for?,"Matplotlib is a Python library used for creating static, animated, and interactive visualizations."
What is Seaborn?,Seaborn is a statistical data visualization library built on top of Matplotlib.
What is Scikit-learn?,"Scikit-learn is a Python library providing simple tools for machine learning such as classification, regression, and clustering."
What is TensorFlow?,TensorFlow is an open-source deep learning framework developed by Google for building and training neural networks.
What is PyTorch?,PyTorch is an open-source deep learning framework developed by Meta known for its dynamic computation graphs.
What is Keras?,Keras is a high-level neural network API that runs on top of TensorFlow for easy model building.
What is Jupyter Notebook?,"Jupyter Notebook is an interactive coding environment that allows mixing code, text, and visualizations in one document."
What is virtual environment in Python?,A virtual environment is an isolated Python environment that allows managing dependencies separately for different projects.
What is pip?,Pip is the package installer for Python used to install and manage libraries.
What is exception handling in Python?,Exception handling uses try-except blocks to catch and handle runtime errors gracefully.
What is object-oriented programming?,"Object-oriented programming organizes code into classes and objects, encapsulating data and behavior together."
What is inheritance in OOP?,Inheritance allows a class to derive properties and methods from another class.
What is polymorphism in OOP?,Polymorphism allows objects of different classes to be treated through a common interface.
What is encapsulation?,Encapsulation restricts direct access to an object's data by bundling it with methods that control access.
What is multithreading in Python?,Multithreading allows concurrent execution of multiple threads to improve performance for I/O-bound tasks.
What is multiprocessing in Python?,Multiprocessing runs separate processes in parallel to utilize multiple CPU cores for CPU-bound tasks.
What is the Global Interpreter Lock (GIL)?,The GIL is a mutex in Python that allows only one thread to execute Python bytecode at a time.
What is the difference between Python 2 and Python 3?,"Python 3 introduced improved Unicode support, print as a function, and is the actively maintained version, unlike the deprecated Python 2."
What is type casting in Python?,"Type casting converts a variable from one data type to another, such as int to float."
What is slicing in Python?,"Slicing extracts a subset of elements from sequences like lists or strings using start, stop, and step indices."
What are *args and **kwargs?,"*args allows passing a variable number of positional arguments, while **kwargs allows variable keyword arguments to a function."
What is recursion?,Recursion is a programming technique where a function calls itself to solve smaller instances of a problem.
What is the difference between is and == in Python?,"== checks value equality, while is checks whether two variables reference the same object in memory."
What is a Python module?,A module is a file containing Python code such as functions and classes that can be imported into other programs.
What is a Python package?,A package is a collection of related modules organized in directories with an __init__.py file.
What is PEP 8?,PEP 8 is the official style guide for writing readable and consistent Python code.
What is duck typing?,Duck typing means an object's suitability is determined by its methods and properties rather than its explicit type.
What is the difference between a function and a method?,"A function is a standalone block of code, while a method is a function defined within a class and tied to an object."
What is a docstring?,"A docstring is a string literal used to document the purpose of a function, class, or module."
What is the use of the __init__ method?,The __init__ method is a constructor automatically called when a new object of a class is created.
What are Python iterators?,Iterators are objects that implement __iter__ and __next__ methods to allow sequential traversal of elements.
What is the difference between append and extend in lists?,"Append adds a single element to a list, while extend adds elements from an iterable individually."
What is a NumPy array?,"A NumPy array is a fast, fixed-type, multi-dimensional data structure used for numerical computations."
What is broadcasting in NumPy?,Broadcasting allows NumPy to perform arithmetic operations on arrays of different shapes without explicit looping.
What is vectorization?,Vectorization replaces explicit loops with array operations to speed up computation in Python.
What is the difference between loc and iloc in Pandas?,"loc selects data by label, while iloc selects data by integer position in a DataFrame."
What is merging in Pandas?,"Merging combines two DataFrames based on common columns or indices, similar to SQL joins."
What is mean in statistics?,The mean is the average value of a dataset calculated by summing all values and dividing by the count.
What is median?,"The median is the middle value of a sorted dataset, robust to outliers."
What is mode?,The mode is the most frequently occurring value in a dataset.
What is variance?,Variance measures how much data points differ from the mean on average.
What is standard deviation?,"Standard deviation is the square root of variance, indicating data spread in original units."
What is a normal distribution?,"A normal distribution is a symmetric, bell-shaped probability distribution defined by its mean and standard deviation."
What is skewness?,Skewness measures the asymmetry of a probability distribution around its mean.
What is kurtosis?,Kurtosis measures the tailedness or peakedness of a probability distribution.
What is a p-value?,"A p-value indicates the probability of observing results as extreme as the data, assuming the null hypothesis is true."
What is a null hypothesis?,The null hypothesis is a default assumption that there is no effect or relationship between variables.
What is a confidence interval?,A confidence interval is a range of values likely to contain a population parameter with a given probability.
What is hypothesis testing?,Hypothesis testing is a statistical method to decide whether to reject or accept a null hypothesis based on sample data.
What is a Type I error?,A Type I error occurs when a true null hypothesis is incorrectly rejected.
What is a Type II error?,A Type II error occurs when a false null hypothesis is incorrectly accepted.
What is correlation?,Correlation measures the strength and direction of a linear relationship between two variables.
What is covariance?,Covariance measures how two variables change together.
What is the difference between correlation and causation?,"Correlation indicates a relationship between variables, while causation implies one variable directly affects another."
What is Bayes theorem?,Bayes theorem describes the probability of an event based on prior knowledge of related conditions.
What is conditional probability?,Conditional probability is the probability of an event occurring given that another event has already occurred.
What is a probability distribution?,A probability distribution describes how probabilities are assigned to different outcomes of a random variable.
What is a binomial distribution?,A binomial distribution models the number of successes in a fixed number of independent trials with two outcomes.
What is a Poisson distribution?,A Poisson distribution models the number of events occurring in a fixed interval of time or space.
What is the Central Limit Theorem?,The Central Limit Theorem states that the sampling distribution of the mean approaches a normal distribution as sample size increases.
What is sampling in statistics?,Sampling is the process of selecting a subset of data from a larger population for analysis.
What is stratified sampling?,Stratified sampling divides a population into subgroups and samples proportionally from each.
What is a z-score?,A z-score represents how many standard deviations a value is from the mean.
What is an outlier?,An outlier is a data point that differs significantly from other observations in a dataset.
What is multicollinearity?,Multicollinearity occurs when independent variables in a regression model are highly correlated with each other.
What is a chi-square test?,A chi-square test determines whether there is a significant association between categorical variables.
What is ANOVA?,ANOVA (Analysis of Variance) tests whether there are significant differences between the means of multiple groups.
What is a t-test?,A t-test compares the means of two groups to determine if they are statistically different.
What is linear algebra used for in ML?,Linear algebra provides the mathematical foundation for representing and manipulating data as vectors and matrices in ML models.
What is a matrix?,A matrix is a rectangular array of numbers arranged in rows and columns used in linear algebra computations.
What is a vector?,A vector is an ordered list of numbers representing magnitude and direction in space.
What is a dot product?,A dot product is the sum of the products of corresponding elements of two vectors.
What is an eigenvalue?,An eigenvalue is a scalar that indicates how much an eigenvector is stretched during a linear transformation.
What is an eigenvector?,An eigenvector is a non-zero vector that only changes by a scalar factor when a linear transformation is applied.
What is matrix multiplication used for in neural networks?,Matrix multiplication combines input data with weights to compute outputs in neural network layers.
What is a derivative used for in ML?,A derivative measures the rate of change of a function and is used to optimize model parameters during training.
What is a partial derivative?,A partial derivative measures the rate of change of a multivariable function with respect to one variable.
What is the chain rule in calculus?,The chain rule computes the derivative of a composite function and underlies backpropagation in neural networks.
What is a probability density function?,A probability density function describes the likelihood of a continuous random variable taking a specific value.
What is entropy in information theory?,Entropy measures the amount of uncertainty or randomness in a dataset or probability distribution.
What is information gain?,"Information gain measures the reduction in entropy achieved by splitting data on a feature, used in decision trees."
What is KL divergence?,KL divergence measures how one probability distribution differs from a reference probability distribution.
What is the law of large numbers?,"The law of large numbers states that as sample size increases, the sample mean converges to the population mean."
What is a random variable?,A random variable is a variable whose value depends on the outcome of a random phenomenon.
What is sampling bias?,"Sampling bias occurs when a sample is not representative of the population, leading to skewed results."
What is bootstrapping in statistics?,Bootstrapping is a resampling technique that estimates statistics by repeatedly sampling with replacement from the data.
What is a percentile?,A percentile indicates the value below which a given percentage of observations fall.
What is interquartile range (IQR)?,"IQR is the range between the first and third quartiles, used to measure statistical dispersion and detect outliers."
What is supervised learning?,Supervised learning uses labeled data to train models for tasks like classification and regression.
What is unsupervised learning?,"Unsupervised learning finds hidden patterns in data without labels, often using clustering or dimensionality reduction."
What is reinforcement learning?,Reinforcement learning trains agents to make decisions by rewarding good actions and penalizing bad ones.
What is semi-supervised learning?,Semi-supervised learning trains models using a small amount of labeled data combined with a large amount of unlabeled data.
What is self-supervised learning?,Self-supervised learning generates labels automatically from the data itself to learn useful representations.
What is linear regression?,Linear regression models the relationship between a dependent variable and one or more independent variables using a straight line.
What is logistic regression?,Logistic regression is a classification algorithm that predicts probabilities using a sigmoid function.
What is a decision tree?,A decision tree is a model that splits data into branches based on feature values to make predictions.
What is ID3 algorithm?,ID3 is a decision tree algorithm that uses information gain to select the best feature for splitting at each node.
What is the Gini index?,The Gini index measures impurity in a dataset and is used to decide splits in decision trees.
What is entropy in decision trees?,"Entropy measures the impurity or randomness of a node, guiding decision tree splits to maximize information gain."
What is pruning in decision trees?,Pruning removes branches from a decision tree to reduce overfitting and improve generalization.
What is a random forest?,A random forest is an ensemble of decision trees that combines their predictions to improve accuracy and reduce overfitting.
What is bagging?,Bagging (Bootstrap Aggregating) trains multiple models on different random subsets of data and averages their predictions.
What is boosting?,Boosting sequentially trains models where each new model corrects errors made by previous ones.
What is AdaBoost?,AdaBoost is a boosting algorithm that adjusts the weights of misclassified samples to improve subsequent models.
What is Gradient Boosting?,Gradient Boosting builds models sequentially by minimizing the loss function using gradient descent on residual errors.
What is XGBoost?,"XGBoost is an optimized, scalable implementation of gradient boosting known for speed and performance."
What is LightGBM?,LightGBM is a gradient boosting framework that uses histogram-based algorithms for faster training on large datasets.
What is ensemble learning?,Ensemble learning combines multiple models to produce better predictive performance than any single model.
What is stacking in ensemble learning?,Stacking combines predictions from multiple models using a meta-model to make the final prediction.
What is K-Nearest Neighbors (KNN)?,KNN is a classification algorithm that assigns a label based on the majority class of the nearest data points.
What is Support Vector Machine (SVM)?,SVM is a classification algorithm that finds the optimal hyperplane to separate classes with maximum margin.
What is a kernel in SVM?,A kernel function transforms data into a higher-dimensional space to make it easier to separate non-linearly separable classes.
What is Naive Bayes?,Naive Bayes is a probabilistic classifier based on Bayes theorem that assumes feature independence.
What is K-Means clustering?,K-Means is an unsupervised algorithm that partitions data into K clusters based on distance to cluster centroids.
How does K-Means choose the number of clusters?,K-Means often uses the elbow method or silhouette score to determine the optimal number of clusters.
What is the elbow method?,The elbow method plots within-cluster variance against the number of clusters to identify the optimal cluster count.
What is hierarchical clustering?,Hierarchical clustering builds a tree of clusters by iteratively merging or splitting groups based on similarity.
What is a dendrogram?,A dendrogram is a tree diagram that illustrates the arrangement of clusters formed by hierarchical clustering.
What is DBSCAN?,DBSCAN is a density-based clustering algorithm that groups points that are closely packed and marks outliers as noise.
What is dimensionality reduction?,Dimensionality reduction reduces the number of features in a dataset while preserving important information.
What is PCA?,Principal Component Analysis (PCA) reduces dimensionality by transforming data into uncorrelated components that capture maximum variance.
What is t-SNE?,t-SNE is a dimensionality reduction technique used to visualize high-dimensional data in two or three dimensions.
What is LDA in machine learning?,Linear Discriminant Analysis (LDA) reduces dimensionality while maximizing class separability for classification tasks.
What is feature selection?,Feature selection chooses the most relevant features from a dataset to improve model performance and reduce complexity.
What is feature extraction?,Feature extraction transforms raw data into a reduced set of meaningful features for modeling.
What is the curse of dimensionality?,The curse of dimensionality refers to performance degradation in models as the number of features increases relative to data size.
What is regularization?,Regularization adds a penalty term to the loss function to prevent overfitting by discouraging complex models.
What is L1 regularization?,"L1 regularization (Lasso) adds the absolute value of coefficients as a penalty, encouraging sparse models."
What is L2 regularization?,"L2 regularization (Ridge) adds the squared value of coefficients as a penalty, shrinking weights without making them zero."
What is Elastic Net?,Elastic Net combines L1 and L2 regularization to balance sparsity and coefficient shrinkage.
What is hyperparameter tuning?,Hyperparameter tuning searches for the best model configuration settings to optimize performance.
What is Grid Search?,Grid Search exhaustively tests all combinations of specified hyperparameter values to find the best model.
What is Random Search?,Random Search samples random combinations of hyperparameters to find a good model configuration more efficiently than grid search.
What is Bayesian Optimization?,Bayesian Optimization uses probabilistic models to intelligently search for optimal hyperparameters with fewer evaluations.
What is a validation set?,A validation set is a portion of data used to tune hyperparameters and assess model performance during training.
What is k-fold cross-validation?,"K-fold cross-validation splits data into k subsets, training and validating the model k times for reliable performance estimates."
What is stratified k-fold cross-validation?,Stratified k-fold cross-validation preserves the percentage of samples for each class in every fold.
What is leave-one-out cross-validation?,"Leave-one-out cross-validation uses a single observation as the validation set and the rest as training data, repeated for all observations."
What is the bias-variance tradeoff?,The bias-variance tradeoff balances model simplicity (high bias) against model flexibility (high variance) to minimize total error.
What is a confusion matrix?,"A confusion matrix is a table used to evaluate classification models by showing true positives, false positives, true negatives, and false negatives."
What is accuracy in ML?,Accuracy is the ratio of correctly predicted observations to the total observations.
What is precision?,Precision is the ratio of correctly predicted positive observations to the total predicted positives.
What is recall?,Recall is the ratio of correctly predicted positives to all actual positives.
What is F1-score?,"The F1-score is the harmonic mean of precision and recall, balancing both metrics."
What is specificity?,Specificity measures the proportion of actual negatives correctly identified by the model.
What is an ROC curve?,An ROC curve plots the true positive rate against the false positive rate at various classification thresholds.
What is AUC?,AUC (Area Under the Curve) measures the overall ability of a classifier to distinguish between classes.
What is a precision-recall curve?,A precision-recall curve shows the tradeoff between precision and recall at different classification thresholds.
What is RMSE?,Root Mean Squared Error (RMSE) is a metric that measures the average magnitude of prediction errors.
What is MAE?,Mean Absolute Error (MAE) measures the average absolute difference between predicted and actual values.
What is MSE?,Mean Squared Error (MSE) measures the average squared difference between predicted and actual values.
What is R²?,R² (coefficient of determination) measures how well regression predictions approximate real data points.
What is adjusted R²?,"Adjusted R² modifies R² to account for the number of predictors in a regression model, penalizing unnecessary complexity."
What is log loss?,Log loss measures the performance of a classification model by penalizing incorrect predictions based on predicted probabilities.
What is class imbalance?,"Class imbalance occurs when one class significantly outnumbers others in a dataset, potentially biasing model predictions."
How do you handle imbalanced datasets?,"Imbalanced datasets can be handled using resampling techniques like SMOTE, class weighting, or choosing appropriate evaluation metrics."
What is SMOTE?,SMOTE (Synthetic Minority Over-sampling Technique) generates synthetic samples for the minority class to balance datasets.
What is undersampling?,Undersampling reduces the number of majority class samples to balance a dataset.
What is oversampling?,Oversampling increases the number of minority class samples to balance a dataset.
What is data preprocessing?,"Data preprocessing involves cleaning, transforming, and preparing raw data for machine learning models."
What is data cleaning?,"Data cleaning involves handling missing values, duplicates, and errors to improve data quality."
How do you handle missing data?,"Missing data can be handled by removing rows, imputing with mean/median/mode, or using model-based imputation."
What is imputation?,Imputation is the process of filling in missing data values using statistical or predictive methods.
What is feature engineering?,Feature engineering creates new input features from raw data to improve model performance.
What is normalization?,"Normalization scales numerical data to a standard range, often between 0 and 1."
What is standardization?,Standardization transforms data to have mean 0 and standard deviation 1.
What is one-hot encoding?,One-hot encoding converts categorical variables into binary vectors representing the presence of each category.
What is label encoding?,Label encoding assigns a unique integer to each category in a categorical variable.
What is the difference between one-hot encoding and label encoding?,"One-hot encoding creates separate binary columns per category, while label encoding assigns ordinal integers, which can mislead models on nominal data."
What is data augmentation?,"Data augmentation artificially increases dataset size by creating modified versions of existing data, common in image and text tasks."
What is outlier detection?,Outlier detection identifies data points that deviate significantly from the rest of the dataset.
What is feature scaling?,Feature scaling adjusts the range of numerical features so that no single feature dominates due to scale differences.
What is overfitting?,Overfitting occurs when a model learns noise in training data and performs poorly on unseen data.
What is underfitting?,Underfitting occurs when a model is too simple and fails to capture patterns in the data.
What is cross-validation?,Cross-validation splits data into multiple folds to evaluate model performance more reliably.
What is gradient descent?,Gradient descent is an optimization algorithm used to minimize loss functions by iteratively updating parameters.
What is stochastic gradient descent?,Stochastic gradient descent updates model parameters using one training sample at a time instead of the full dataset.
What is mini-batch gradient descent?,"Mini-batch gradient descent updates parameters using small batches of data, balancing speed and stability."
What is a learning rate?,The learning rate controls the step size used to update model parameters during gradient descent.
What is learning rate decay?,Learning rate decay gradually reduces the learning rate during training to allow finer convergence.
What is a loss function?,"A loss function measures the difference between predicted and actual values, guiding model training."
